Account,Post,Comment,Commented by
NancyLandgraab,I'm going to Boracay but I don't know what to do. Do you have any ideas?,Just swim! The beach there is great!,Victor_Smith
VitaAlto29,What do I do if my computer freezes?,Reboot your PC,DogLover88
Victor_Smith,How do I get better at math?,Practice makes perfect! (Then maybe you'll become a doctor like me),DrErickKlinghammer
DogLover88,Do they still sell The Sims 3 CDs?,Might be rare to find. Try checking Shoppee or Lazada.,NancyLandgraab
DrErickKlinghammer,Do birds really appear when someone beautiful is near?,Maybe if they have peanuts,VitaAlto29
,,,
,,,
,,,
